### ISSUE TITLE
Setting promiscphys=true on a vnic in bhyve breaks host/zone -> vm traffic

### ISSUE THREAD

**Issue by sjorge** [omniosorg/illumos-omnios#1039]
Took me a bit to figure out but when enabling `promiscphys` to get things like CARP work, it breaks host -> vm traffic.

| origin | destination | works |
| -- | -- | -- |
| host | vm | no |
| zone | vm | no |
| vm | vm | no |
| device* | vm | **yes** |

* device as another device on the network that is not the node running the vm

Looks like the TCP checksum is incorrect and the packet rejected, might also explain why ping does work.
I tried both IPv6 and IPv4 the result is the same.

```
Frame 1: 94 bytes on wire (752 bits), 94 bytes captured (752 bits)
    Encapsulation type: Ethernet (1)
    Arrival Time: Aug 19, 2021 17:00:58.701450000 CEST
    [Time shift for this packet: 0.000000000 seconds]
    Epoch Time: 1629385258.701450000 seconds
    [Time delta from previous captured frame: 0.000000000 seconds]
    [Time delta from previous displayed frame: 0.000000000 seconds]
    [Time since reference or first frame: 0.000000000 seconds]
    Frame Number: 1
    Frame Length: 94 bytes (752 bits)
    Capture Length: 94 bytes (752 bits)
    [Frame is marked: False]
    [Frame is ignored: False]
    [Protocols in frame: eth:ethertype:ipv6:tcp]
    [Coloring Rule Name: Checksum Errors]
    [Coloring Rule String [truncated]: eth.fcs.status=="Bad" || ip.checksum.status=="Bad" || tcp.checksum.status=="Bad" || udp.checksum.status=="Bad" || sctp.checksum.status=="Bad" || mstp.checksum.status=="Bad" || cdp.checksum.status=="Bad" |]
Ethernet II, Src: Cyberdyn_eb:db:e2 (00:22:06:eb:db:e2), Dst: Cyberdyn_eb:5c:9f (00:22:06:eb:5c:9f)
    Destination: Cyberdyn_eb:5c:9f (00:22:06:eb:5c:9f)
    Source: Cyberdyn_eb:db:e2 (00:22:06:eb:db:e2)
    Type: IPv6 (0x86dd)
Internet Protocol Version 6, Src: 2a02:578:470f:10::101, Dst: 2a02:578:470f:10::1042
    0110 .... = Version: 6
    .... 0001 0000 .... .... .... .... .... = Traffic Class: 0x10 (DSCP: Unknown, ECN: Not-ECT)
    .... .... .... 0000 0000 0000 0000 0000 = Flow Label: 0x00000
    Payload Length: 40
    Next Header: TCP (6)
    Hop Limit: 60
    Source Address: 2a02:578:470f:10::101
    Destination Address: 2a02:578:470f:10::1042
Transmission Control Protocol, Src Port: 40704, Dst Port: 22, Seq: 0, Len: 0
    Source Port: 40704
    Destination Port: 22
    [Stream index: 0]
    [TCP Segment Len: 0]
    Sequence Number: 0    (relative sequence number)
    Sequence Number (raw): 3370996639
    [Next Sequence Number: 1    (relative sequence number)]
    Acknowledgment Number: 0
    Acknowledgment number (raw): 0
    1010 .... = Header Length: 40 bytes (10)
    Flags: 0x002 (SYN)
        000. .... .... = Reserved: Not set
        ...0 .... .... = Nonce: Not set
        .... 0... .... = Congestion Window Reduced (CWR): Not set
        .... .0.. .... = ECN-Echo: Not set
        .... ..0. .... = Urgent: Not set
        .... ...0 .... = Acknowledgment: Not set
        .... .... 0... = Push: Not set
        .... .... .0.. = Reset: Not set
        .... .... ..1. = Syn: Set
            [Expert Info (Chat/Sequence): Connection establish request (SYN): server port 22]
                [Connection establish request (SYN): server port 22]
                [Severity level: Chat]
                [Group: Sequence]
        .... .... ...0 = Fin: Not set
        [TCP Flags: ··········S·]
    Window: 64080
    [Calculated window size: 64080]
    Checksum: 0xfea3 incorrect, should be 0x0d51(maybe caused by "TCP checksum offload"?)
        [Expert Info (Error/Checksum): Bad checksum [should be 0x0d51]]
            [Bad checksum [should be 0x0d51]]
            [Severity level: Error]
            [Group: Checksum]
    [Checksum Status: Bad]
    [Calculated Checksum: 0x0d51]
    Urgent Pointer: 0
    Options: (20 bytes), Maximum segment size, SACK permitted, Timestamps, No-Operation (NOP), Window scale
        TCP Option - Maximum segment size: 1440 bytes
            Kind: Maximum Segment Size (2)
            Length: 4
            MSS Value: 1440
        TCP Option - SACK permitted
            Kind: SACK Permitted (4)
            Length: 2
        TCP Option - Timestamps: TSval 80707984, TSecr 0
            Kind: Time Stamp Option (8)
            Length: 10
            Timestamp value: 80707984
            Timestamp echo reply: 0
        TCP Option - No-Operation (NOP)
            Kind: No-Operation (1)
        TCP Option - Window scale: 1 (multiply by 2)
            Kind: Window Scale (3)
            Length: 3
            Shift count: 1
            [Multiplier: 2]
    [Timestamps]
        [Time since first frame in this TCP stream: 0.000000000 seconds]
        [Time since previous frame in this TCP stream: 0.000000000 seconds]
```

The other packets after it are the same but marked as retransmit, which is what we'd expect.

Here is a capture of nearly an identical VM but without promiscphys=true, the first frame of a SSH connection
```
Frame 1: 94 bytes on wire (752 bits), 94 bytes captured (752 bits)
    Encapsulation type: Ethernet (1)
    Arrival Time: Aug 19, 2021 17:05:32.700451000 CEST
    [Time shift for this packet: 0.000000000 seconds]
    Epoch Time: 1629385532.700451000 seconds
    [Time delta from previous captured frame: 0.000000000 seconds]
    [Time delta from previous displayed frame: 0.000000000 seconds]
    [Time since reference or first frame: 0.000000000 seconds]
    Frame Number: 1
    Frame Length: 94 bytes (752 bits)
    Capture Length: 94 bytes (752 bits)
    [Frame is marked: False]
    [Frame is ignored: False]
    [Protocols in frame: eth:ethertype:ipv6:tcp]
    [Coloring Rule Name: TCP SYN/FIN]
    [Coloring Rule String: tcp.flags & 0x02 || tcp.flags.fin == 1]
Ethernet II, Src: Cyberdyn_eb:db:e2 (00:22:06:eb:db:e2), Dst: Cyberdyn_ae:a3:64 (00:22:06:ae:a3:64)
    Destination: Cyberdyn_ae:a3:64 (00:22:06:ae:a3:64)
    Source: Cyberdyn_eb:db:e2 (00:22:06:eb:db:e2)
    Type: IPv6 (0x86dd)
Internet Protocol Version 6, Src: 2a02:578:470f:10::101, Dst: 2a02:578:470f:10::2042
    0110 .... = Version: 6
    .... 0001 0000 .... .... .... .... .... = Traffic Class: 0x10 (DSCP: Unknown, ECN: Not-ECT)
    .... .... .... 0000 0000 0000 0000 0000 = Flow Label: 0x00000
    Payload Length: 40
    Next Header: TCP (6)
    Hop Limit: 60
    Source Address: 2a02:578:470f:10::101
    Destination Address: 2a02:578:470f:10::2042
Transmission Control Protocol, Src Port: 33012, Dst Port: 22, Seq: 0, Len: 0
    Source Port: 33012
    Destination Port: 22
    [Stream index: 0]
    [TCP Segment Len: 0]
    Sequence Number: 0    (relative sequence number)
    Sequence Number (raw): 1085336387
    [Next Sequence Number: 1    (relative sequence number)]
    Acknowledgment Number: 0
    Acknowledgment number (raw): 0
    1010 .... = Header Length: 40 bytes (10)
    Flags: 0x002 (SYN)
        000. .... .... = Reserved: Not set
        ...0 .... .... = Nonce: Not set
        .... 0... .... = Congestion Window Reduced (CWR): Not set
        .... .0.. .... = ECN-Echo: Not set
        .... ..0. .... = Urgent: Not set
        .... ...0 .... = Acknowledgment: Not set
        .... .... 0... = Push: Not set
        .... .... .0.. = Reset: Not set
        .... .... ..1. = Syn: Set
            [Expert Info (Chat/Sequence): Connection establish request (SYN): server port 22]
                [Connection establish request (SYN): server port 22]
                [Severity level: Chat]
                [Group: Sequence]
        .... .... ...0 = Fin: Not set
        [TCP Flags: ··········S·]
    Window: 64080
    [Calculated window size: 64080]
    Checksum: 0xe390 [correct]
    [Checksum Status: Good]
    [Calculated Checksum: 0xe390]
    Urgent Pointer: 0
    Options: (20 bytes), Maximum segment size, SACK permitted, Timestamps, No-Operation (NOP), Window scale
        TCP Option - Maximum segment size: 1440 bytes
            Kind: Maximum Segment Size (2)
            Length: 4
            MSS Value: 1440
        TCP Option - SACK permitted
            Kind: SACK Permitted (4)
            Length: 2
        TCP Option - Timestamps: TSval 80980465, TSecr 0
            Kind: Time Stamp Option (8)
            Length: 10
            Timestamp value: 80980465
            Timestamp echo reply: 0
        TCP Option - No-Operation (NOP)
            Kind: No-Operation (1)
        TCP Option - Window scale: 1 (multiply by 2)
            Kind: Window Scale (3)
            Length: 3
            Shift count: 1
            [Multiplier: 2]
    [Timestamps]
        [Time since first frame in this TCP stream: 0.000000000 seconds]
        [Time since previous frame in this TCP stream: 0.000000000 seconds]
```

**Comment by sjorge** [comment]
As asked by @danmcd 

This is vm -> host (sniffed on the hosts's vnic)
```
Frame 1: 94 bytes on wire (752 bits), 94 bytes captured (752 bits)
    Encapsulation type: Ethernet (1)
    Arrival Time: Aug 19, 2021 17:19:38.922496000 CEST
    [Time shift for this packet: 0.000000000 seconds]
    Epoch Time: 1629386378.922496000 seconds
    [Time delta from previous captured frame: 0.000000000 seconds]
    [Time delta from previous displayed frame: 0.000000000 seconds]
    [Time since reference or first frame: 0.000000000 seconds]
    Frame Number: 1
    Frame Length: 94 bytes (752 bits)
    Capture Length: 94 bytes (752 bits)
    [Frame is marked: False]
    [Frame is ignored: False]
    [Protocols in frame: eth:ethertype:ipv6:tcp]
    [Coloring Rule Name: TCP SYN/FIN]
    [Coloring Rule String: tcp.flags & 0x02 || tcp.flags.fin == 1]
Ethernet II, Src: Cyberdyn_eb:5c:9f (00:22:06:eb:5c:9f), Dst: Cyberdyn_eb:db:e2 (00:22:06:eb:db:e2)
    Destination: Cyberdyn_eb:db:e2 (00:22:06:eb:db:e2)
    Source: Cyberdyn_eb:5c:9f (00:22:06:eb:5c:9f)
    Type: IPv6 (0x86dd)
Internet Protocol Version 6, Src: 2a02:578:470f:10::1042, Dst: 2a02:578:470f:10::101
    0110 .... = Version: 6
    .... 0000 0000 .... .... .... .... .... = Traffic Class: 0x00 (DSCP: CS0, ECN: Not-ECT)
    .... .... .... 0001 0101 1111 0000 0110 = Flow Label: 0x15f06
    Payload Length: 40
    Next Header: TCP (6)
    Hop Limit: 64
    Source Address: 2a02:578:470f:10::1042
    Destination Address: 2a02:578:470f:10::101
Transmission Control Protocol, Src Port: 51321, Dst Port: 22, Seq: 0, Len: 0
    Source Port: 51321
    Destination Port: 22
    [Stream index: 0]
    [TCP Segment Len: 0]
    Sequence Number: 0    (relative sequence number)
    Sequence Number (raw): 121978902
    [Next Sequence Number: 1    (relative sequence number)]
    Acknowledgment Number: 0
    Acknowledgment number (raw): 0
    1010 .... = Header Length: 40 bytes (10)
    Flags: 0x002 (SYN)
        000. .... .... = Reserved: Not set
        ...0 .... .... = Nonce: Not set
        .... 0... .... = Congestion Window Reduced (CWR): Not set
        .... .0.. .... = ECN-Echo: Not set
        .... ..0. .... = Urgent: Not set
        .... ...0 .... = Acknowledgment: Not set
        .... .... 0... = Push: Not set
        .... .... .0.. = Reset: Not set
        .... .... ..1. = Syn: Set
            [Expert Info (Chat/Sequence): Connection establish request (SYN): server port 22]
                [Connection establish request (SYN): server port 22]
                [Severity level: Chat]
                [Group: Sequence]
        .... .... ...0 = Fin: Not set
        [TCP Flags: ··········S·]
    Window: 65535
    [Calculated window size: 65535]
    Checksum: 0xb440 [correct]
    [Checksum Status: Good]
    [Calculated Checksum: 0xb440]
    Urgent Pointer: 0
    Options: (20 bytes), Maximum segment size, No-Operation (NOP), Window scale, SACK permitted, Timestamps
        TCP Option - Maximum segment size: 8940 bytes
            Kind: Maximum Segment Size (2)
            Length: 4
            MSS Value: 8940
        TCP Option - No-Operation (NOP)
            Kind: No-Operation (1)
        TCP Option - Window scale: 6 (multiply by 64)
            Kind: Window Scale (3)
            Length: 3
            Shift count: 6
            [Multiplier: 64]
        TCP Option - SACK permitted
            Kind: SACK Permitted (4)
            Length: 2
        TCP Option - Timestamps: TSval 2334383364, TSecr 0
            Kind: Time Stamp Option (8)
            Length: 10
            Timestamp value: 2334383364
            Timestamp echo reply: 0
    [Timestamps]
        [Time since first frame in this TCP stream: 0.000000000 seconds]
        [Time since previous frame in this TCP stream: 0.000000000 seconds]

```

**Comment by Makr91** [comment]
Does this break traffic to just the one VM? or all VMs on the host?

Have you tried disabling hardware offload inside of pfSense?

**Comment by sjorge** [comment]
Hardware offloading is disable, it’s not firewall vm though. So nothing special like nat is in play here.

It’s just traffic to the specific vm from the host it self, or we’ll anything on the host.  Other vm’s and even a nic on the same vm without promiscphys=true work fine.

**Comment by sjorge** [comment]
For completeness this is what I have disabled"
```-rxcsum -txcsum -vlanmtu -vlanhwtag -vlanhwcsum -vlanhwfilter``` which results in ```em0: flags=8963<UP,BROADCAST,RUNNING,PROMISC,SIMPLEX,MULTICAST> metric 0 mtu 9000```

**Comment by Makr91** [comment]
Okay, I am trying to enable promiscphys, and that option only seems to be available to set via zadm? is there a way to configure this via zonecfg, and/or zonecfg + other commands instead of using zadm to enable this?

**Comment by hadfl** [comment]
in a `net` section: `add property (name=promiscphys,value="on")`.

**Comment by Makr91** [comment]
I was able to get CARP to work in pfSense and the host can communicate to the virtual IP, however this is with the E1000 netif attr.

Have you tried it with both adapter firmware/types?

**Comment by sjorge** [comment]
Yeah it still doesn't work properly even with e1000 nic type, I had to resort to using ppt to pass a whole nic to the VMs.

The host can reach the CARP IP only if the VM it is hosting is the master one, the other host having the VM that is the backup one, can't connect to the CARP IP, well traffic ends up on the backup VM which rejects it.

**Comment by sjorge** [comment]
Was still an issue when ran into this again about a month ago.

**Comment by Makr91** [comment]
Have you tried it on the virtio-net-viona driver type? I was told that may have some fixes that would enabled this.

**Comment by sjorge** [comment]
Yes, viona sadly was worse than plain virtio or e1000.
It was slightly better with one of @citrus-it 's patches but not quite right still.
